source_type,source_name,published_at,page_title,excerpt,url,frame_tag
partner_media,CNN,2026-03-21,CNN.com - Transcripts,"CNN.com - Transcripts Transcript Providers Return to Transcripts main page CNN's The Arena with Kasie Hunt Cracks Emerge In GOP Over Iran War And Growing Cost; Will More Republicans Break With Trump On Iran War?; Trump On Gas Prices: ""I Thought It Would Be Worse""; Experts Warn Oil Prices Could Surge Past Record High If Iran War Persists, As U.S. Gas Hovers Around $4 A Gallon; Will Trump's Decision To Launch Iran War Help 2028 Dem Contenders?; 1931: Nevada Becomes First State To Legalize Casino G",https://transcripts.cnn.com/show/arena/date/2026-03-21/segment/01,growth_legitimacy
partner_media,CNN,2026-03-24,CNN.com - Transcripts,"CNN.com - Transcripts Transcript Providers Return to Transcripts main page Quest Means Business Trump: We Are In Negotiations With Iran; Conflict Weighs On European Economies; NTSB Gives Update On Runway Collision; Trader Wins Nearly $1 Million On Polymarket With Accurate Iran Bets; Explosion At Texas Refinery Puts More Pressure On Gas Prices; OpenAI To Discontinue Its Sora Video Platform; Coffee Prices Rise As Iran War Rattles Global Supply Chains. Aired 4-5p ET Aired March 24, 2026 - 16:00 ET ",https://transcripts.cnn.com/show/qmb/date/2026-03-24/segment/01,scandal_integrity
partner_media,CNN,2026-03-24,CNN.com - Transcripts,"CNN.com - Transcripts Transcript Providers Return to Transcripts main page Inside Politics Gov. Moore: Trump's ICE Deployments Part Of ""Larger Plan""; Exclusive: Trader Net Nearly $1M With Remarkably Accurate Iran Bets; How To Stay Hopeful Amid Turbulent Times. Aired 12:30-1p ET Aired March 24, 2026 - 12:30 ET THIS IS A RUSH TRANSCRIPT. THIS COPY MAY NOT BE IN ITS FINAL FORM AND MAY BE UPDATED. (BEGIN VIDEO CLIP) [12:30:00] GOV. WES MOORE (D), MARYLAND: -- untrained and who are unqualified and wh",https://transcripts.cnn.com/show/ip/date/2026-03-24/segment/02,price_as_signal
partner_media,CNN,2026-03-24,CNN.com - Transcripts,"CNN.com - Transcripts Transcript Providers Return to Transcripts main page CNN News Central Texas Oil Refinery Fire Pushes Up Gas Prices; Report From Bubblemaps Raises Concerns About Potential Insider Trading on Polymarket; NTSB to Soon Update on Deadly LaGuardia Runway Crash; Delta Suspends Some Services for Congress Amid Government Shutdown. Aired 1:30-2p ET Aired March 24, 2026 - 13:30 ET THIS IS A RUSH TRANSCRIPT. THIS COPY MAY NOT BE IN ITS FINAL FORM AND MAY BE UPDATED. (COMMERCIAL BREAK) ",https://transcripts.cnn.com/show/cnc/date/2026-03-24/segment/08,scandal_integrity
partner_media,CNN,2026-03-28,CNN.com - Transcripts,"CNN.com - Transcripts Transcript Providers Return to Transcripts main page Smerconish Strategic Ambiguity Or Incoherence; Satellite Images Show Saudi Airbase Where Iran Strike Injured At Least 10 U.S. Troops; Rubio: U.S. Can Achieve Iran War Objectives Without Ground Troops. ""No Kings"" Protests Scheduled Across The Country; Well-Timed Iran War Bets Raise Questions. Aired 9-10a ET Aired March 28, 2026 - 09:00 ET THIS IS A RUSH TRANSCRIPT. THIS COPY MAY NOT BE IN ITS FINAL FORM AND MAY BE UPDATED.",https://transcripts.cnn.com/show/smer/date/2026-03-28/segment/01,other_context
partner_media,CNN,2026-03-30,CNN.com - Transcripts,"CNN.com - Transcripts Transcript Providers Return to Transcripts main page CNN News Central White House Says Talks with Iran Going Well, Iran Says They Are Not; Michigan Synagogue Attack was Hezbollah-Inspired Act of Terrorism; Fed Prosecutors Exploring Whether Certain Lucrative Prediction Market Bets Violate Insider Trading Laws; Interview with Rep. Eric Swalwell (D-CA): WAPO, NYT: FBI Director Patel Pushing to Release Documents on Rep. Swalwell. Aired 3:30-4p ET Aired March 30, 2026 - 15:30 ET",https://transcripts.cnn.com/show/cnc/date/2026-03-30/segment/12,scandal_integrity
partner_media,CNN,2026-04-22,CNN.com - Transcripts,"CNN.com - Transcripts Transcript Providers Return to Transcripts main page CNN News Central Iran President Says U.S. Blockade and Threats are Obstacles to Negotiation; Iran Says It Seized Two Ships After Trump Extends Ceasefire; Traveling Doctor Treats Rural Cancer Patients Across Colorado; Kalshi Prediction Site Suspends Three Political Candidates for Betting on Their Own Races; Hakeem Jeffries Warns Florida GOP Over New Map. Aired 3:30-4p ET Aired April 22, 2026 - 15:30 ET THIS IS A RUSH TRANS",https://transcripts.cnn.com/show/cnc/date/2026-04-22/segment/12,scandal_integrity
partner_media,CNN,2026-04-23,CNN.com - Transcripts,CNN.com - Transcripts Transcript Providers Return to Transcripts main page Connect the World U.S.-Israel War with Iran; Trump Tripling Effort to Clear Strait of Hormuz of Mines; U.S. Navy Secretary Ousted; Journalist Killed in Lebanon during Israeli Strike; Ukraine Cannot Defer Help until Iran War is Over; Palestinian Schoolboy Killed by Israeli Settlers; Paramount's Unsettling Potential Takeover of Warner Bros. Discovery; Political Candidates Caught Betting on Their Own Campaigns; Epstein Files,https://transcripts.cnn.com/show/ctw/date/2026-04-23/segment/02,growth_legitimacy
partner_media,CNN,2026-04-23,CNN.com - Transcripts,"CNN.com - Transcripts Transcript Providers Return to Transcripts main page One World with Zain Asher Ceasefire In Place In Lebanon, Both Sides Report Violations; Sources: U.S. navy Secretary Told To Resign Or Be Fired; European Business Activity Drops Due To Iran War; U.N.: Even If War Stops, 30M Plus People Will Fall Into Poverty; Site Accuses Three Candidates Of Betting On Their Own Races; CNN Investigates Claims Of Sexual Abuse by Other Men; Officials: Nearly 800 People Killed In Gaza Since O",https://transcripts.cnn.com/show/ow/date/2026-04-23/segment/02,growth_legitimacy
partner_media,CNN,2026-04-24,CNN.com - Transcripts,"CNN.com - Transcripts Transcript Providers Return to Transcripts main page The Situation Room Hegseth Says, Our Blockade is Growing and Going Global; Indictment Says, U.S. Soldier from Maduro Capture Won $400,000 on Raid Bet; People Injured, Homes Destroyed After Tornado Hits Central Oklahoma. Aired 10-10:30a ET Aired April 24, 2026 - 10:00 ET THIS IS A RUSH TRANSCRIPT. THIS COPY MAY NOT BE IN ITS FINAL FORM AND MAY BE UPDATED. (COMMERCIAL BREAK) [10:00:00] PAMELA BROWN, CNN ANCHOR: Happening no",https://transcripts.cnn.com/show/sitroom/date/2026-04-24/segment/01,scandal_integrity
partner_media,CNN,2026-04-28,CNN.com - Transcripts,"CNN.com - Transcripts Transcript Providers Return to Transcripts main page CNN News Central Hearing For A Man Charged With Killing Two USF Doctoral Students; Trump Endorses Rebranding ICE As ""Nice""; Today: Opening Statements Expected In Musk V. Altman Trial. Aired 9:30-10a ET Aired April 28, 2026 - 09:30 ET THIS IS A RUSH TRANSCRIPT. THIS COPY MAY NOT BE IN ITS FINAL FORM AND MAY BE UPDATED. KATE BOLDUAN, CNN ANCHOR: Joining me right now. Isabel, what's the very latest? What are you learning her",https://transcripts.cnn.com/show/cnc/date/2026-04-28/segment/06,scandal_integrity
partner_media,CNN,2026-05-01,CNN.com - Transcripts,"CNN.com - Transcripts Transcript Providers Return to Transcripts main page CNN News Central Who's to Blame for Increase in Gas Prices; Apple Reports $111 Billion Plus Revenue in Best March Quarter Ever; Tory Burch Foundation Honors Anna Wintour Ahead of Met Gala. Aired 9:30-10a ET Aired May 01, 2026 - 09:30 ET THIS IS A RUSH TRANSCRIPT. THIS COPY MAY NOT BE IN ITS FINAL FORM AND MAY BE UPDATED. [09:30:00] PETE MUNTEAN, CNN AVIATION CORRESPONDENT: Silent Bob? UNIDENTIFIED MALE: Yes, because he ne",https://transcripts.cnn.com/show/cnc/date/2026-05-01/segment/06,regulatory_jurisdiction
partner_media,CNN,2026-05-04,CNN.com - Transcripts,"CNN.com - Transcripts Transcript Providers Return to Transcripts main page CNN News Central Acting A.G. on Comey Indictment; DeSantis Chances for 2028; Matthew Rhys is Interviewed about ""Widow's Bay"". Aired 9:30-10a ET Aired May 04, 2026 - 09:30 ET THIS IS A RUSH TRANSCRIPT. THIS COPY MAY NOT BE IN ITS FINAL FORM AND MAY BE UPDATED. (COMMERCIAL BREAK) [09:30:41] KATE BOLDUAN, CNN ANCHOR: So, the indictment was handed down. The former FBI director turned himself in and says he's ready to fight. N",https://transcripts.cnn.com/show/cnc/date/2026-05-04/segment/06,scandal_integrity
partner_media,CNN,2026-05-05,CNN.com - Transcripts,"CNN.com - Transcripts Transcript Providers Return to Transcripts main page CNN News Central Jared Spataro is Interviewed about Microsoft; Polls on November Elections; Celebrities Stun at Met Gala. Aired 9:30-10a ET Aired May 05, 2026 - 09:30 ET THIS IS A RUSH TRANSCRIPT. THIS COPY MAY NOT BE IN ITS FINAL FORM AND MAY BE UPDATED. (COMMERCIAL BREAK) [09:31:11] KATE BOLDUAN, CNN ANCHOR: New this morning, the Trump administration just announced agreements with top AI firms giving the government some",https://transcripts.cnn.com/show/cnc/date/2026-05-05/segment/06,other_context
partner_media,CNN,2026-05-06,CNN.com - Transcripts,"CNN.com - Transcripts Transcript Providers Return to Transcripts main page CNN News Central Jane Harman is Interviewed about the One-Page Memo to End the War; White House Ballroom Numbers; Pennsylvania sues A.I. Company. Aired 9:30-10a ET Aired May 06, 2026 - 09:30 ET THIS IS A RUSH TRANSCRIPT. THIS COPY MAY NOT BE IN ITS FINAL FORM AND MAY BE UPDATED. (COMMERCIAL BREAK) [09:31:51] SARA SIDNER, CNN ANCHOR: All right, we've got major developments that happened this morning on the war with Iran. C",https://transcripts.cnn.com/show/cnc/date/2026-05-06/segment/06,regulatory_jurisdiction
partner_media,CNN,2026-05-14,CNN.com - Transcripts,"CNN.com - Transcripts Transcript Providers Return to Transcripts main page CNN News Central Xi Hails New Era in U.S.-China Relations; Crash Survivors Saved After Hours in Life Rafts; Politics and the Pump; Closing Arguments in Musk vs. Altman Trial. Aired 9:30-10a ET Aired May 14, 2026 - 09:30 ET THIS IS A RUSH TRANSCRIPT. THIS COPY MAY NOT BE IN ITS FINAL FORM AND MAY BE UPDATED. [09:30:00] ERIC BLAND, ATTORNEY FOR VICTIMS OF ALEX MURDAUGH'S FINANCIAL CRIMES: Knows no distance. Maggie and Paul ",https://transcripts.cnn.com/show/cnc/date/2026-05-14/segment/06,other_context
partner_media,CNN,2026-05-29,CNN.com - Transcripts,CNN.com - Transcripts Transcript Providers Return to Transcripts main page The Brief with Jim Sciutto Drone Strike In Romania; Two Injured After Drone Hits Apartment Building In Romania; Laos Cave Rescue Operation; Rescue Ops To Resume After First Survivor Exits Cave; Kalshi Sues Minnesota Over Its Ban On Prediction Markets; Rising Prices Driving Up Food Insecurity In U.S.; Trump Weighs Deal With Iran; Bondi Grilled By Lawmakers On Capitol Hill; Judge Orders Kennedy Center To Remove Trump's Name,https://transcripts.cnn.com/show/tbwjs/date/2026-05-29/segment/01,scandal_integrity
partner_media,CNN,2026-06-03,CNN.com - Transcripts,"CNN.com - Transcripts Transcript Providers Return to Transcripts main page The Situation Room Iranian Military Says it Targeted U.S. Bases in Kuwait and Bahrain; Ukraine Strikes Back Against Russia; Sources: George Santos Investigated for Alleged Insider Trading; Sources: Ethics Committee Probing Rep. Gomez Sexual Misconduct Claims. Aired 11:30-12p ET Aired June 03, 2026 - 11:30 ET THIS IS A RUSH TRANSCRIPT. THIS COPY MAY NOT BE IN ITS FINAL FORM AND MAY BE UPDATED. [11:30:00] PETE MUNTEAN, CNN ",https://transcripts.cnn.com/show/sitroom/date/2026-06-03/segment/04,scandal_integrity
partner_media,CNN,2026-06-09,CNN.com - Transcripts,"CNN.com - Transcripts Transcript Providers Return to Transcripts main page CNN This Morning Trump Attends NBA Finals Game and Knicks Lose; Texas Tech QB Ruled Eligible after Sports Betting Ban. Aired 6-6:30a ET Aired June 09, 2026 - 06:00 ET THIS IS A RUSH TRANSCRIPT. THIS COPY MAY NOT BE IN ITS FINAL FORM AND MAY BE UPDATED. BRAD SMITH, CNN ANCHOR: Fortunately, no one was hurt. [06:00:03] And in Texas, a nearly 8-foot alligator was caught horsing around in a stable. An employee was able to wran",https://transcripts.cnn.com/show/ctmo/date/2026-06-09/segment/01,other_context
partner_media,CNN,2026-06-30,CNN.com - Transcripts,"CNN.com - Transcripts Transcript Providers Return to Transcripts main page CNN News Central Miraculous Rescues in Venezuela; Polls on Proud to be an American; Two Astronauts make ISS Repairs. Aired 9:30-10a ET Aired June 30, 2026 - 09:30 ET THIS IS A RUSH TRANSCRIPT. THIS COPY MAY NOT BE IN ITS FINAL FORM AND MAY BE UPDATED. [09:30:00] KATE BOLDUAN, CNN ANCHOR: And rescued. And also right now NASA astronauts are venturing outside the International Space Station. What we know about this mission. ",https://transcripts.cnn.com/show/cnc/date/2026-06-30/segment/06,other_context
partner_media,CNN,2026-07-16,CNN.com - Transcripts,"CNN.com - Transcripts Transcript Providers Return to Transcripts main page CNN's The Arena with Kasie Hunt Sources: Trump To Push Foreign Meddling Claims In Speech; Officials Probe If White House Aide Profited Off Trump's Words; Source: Blanche Meeting With Epstein Survivors This Hour; Hegseth's New Policy Will Test Troops For Low Testosterone. Aired 4-5p ET Aired July 16, 2026 - 16:00 ET THIS IS A RUSH TRANSCRIPT. THIS COPY MAY NOT BE IN ITS FINAL FORM AND MAY BE UPDATED. [16:00:00] BRIANNA KEI",https://transcripts.cnn.com/show/arena/date/2026-07-16/segment/01,other_context
partner_media,CNN,2026-07-16,CNN.com - Transcripts,"CNN.com - Transcripts Transcript Providers Return to Transcripts main page CNN News Central Air Quality in Some U.S. Cities Hazardous from Wildfire Smoke; Trump to Push Foreign Meddling Claims in Election Speech; Vance Says Trump Administration Screwed Up Epstein Files Release; At Least 1 Dead in Texas Hill Country Flooding; Trump's Teleprompter Operator Under Investigation for Insider Trading. Aired 3:30-4p ET Aired July 16, 2026 - 15:30 ET THIS IS A RUSH TRANSCRIPT. THIS COPY MAY NOT BE IN ITS",https://transcripts.cnn.com/show/cnc/date/2026-07-16/segment/12,scandal_integrity
partner_media,CNN,2026-07-16,CNN.com - Transcripts,"CNN.com - Transcripts Transcript Providers Return to Transcripts main page Laura Coates Live Donald Trump Addresses Election System Issues at His Primetime Address to the Nation; Trump to Sell Truth Social Posts for Priority Access; One of Epstein Survivors Speak Out Following Todd Blanche's Meeting at the DOJ. Aired 11p-12a ET Aired July 16, 2026 - 23:00 ET THIS IS A RUSH TRANSCRIPT. THIS COPY MAY NOT BE IN ITS FINAL FORM AND MAY BE UPDATED. [23:00:37] LAURA COATES, CNN ANCHOR, AND SENIOR LEGAL",https://transcripts.cnn.com/show/lcl/date/2026-07-16/segment/01,regulatory_jurisdiction
partner_media,CNN,2026-07-16,CNN.com - Transcripts,"CNN.com - Transcripts Transcript Providers Return to Transcripts main page One World with Zain Asher Warning For ""Large And Deadly Flood Wave"" On Guadalupe River; Wildfire Smoke Impacting Air Quality For 100 Million Plus People In United States; Vance: Some Israel Officials Seeking To Derail Iran Diplomacy; U.S. Secretary Of State Hosts International Summit On Left-Wing Terrorism; Defending Champions Argentina Win Semifinal Against England; Trump To Speak ON ""Free And Fair Elections"" Tonight; So",https://transcripts.cnn.com/show/ow/date/2026-07-16/segment/02,other_context
partner_media,CNN,2026-07-16,CNN.com - Transcripts,CNN.com - Transcripts Transcript Providers Return to Transcripts main page Quest Means Business Protests in Ukraine After Zelenskyy Ousts Defense Minister; Truth Social Will Sell Wall Street Quicker Access to Posts; U.S. Announces New 25 Percent on Certain Brazilian Goods. Lovelace CEO on How A.I. is Changing National Defense; Standard Nuclear Shares Fall After IPO; Route 66 Road Trip Continues; Christopher Nolan Directs $250 Million Adaptation of Greek Epic; Visiting All 48 World Cup Contenders,https://transcripts.cnn.com/show/qmb/date/2026-07-16/segment/01,other_context
partner_media,CNN,2026-07-17,CNN.com - Transcripts,"CNN.com - Transcripts Transcript Providers Return to Transcripts main page CNN This Morning Trump Gives Speech on Election Security; Spain v. Argentina: World Cup Final This Weekend. Aired 6-6:30a ET Aired July 17, 2026 - 06:00 ET THIS IS A RUSH TRANSCRIPT. THIS COPY MAY NOT BE IN ITS FINAL FORM AND MAY BE UPDATED. BRAD SMITH, CNN ANCHOR: Filming in the rain when they saw it was stranded in the water and quickly paddled over to help. [06:00:07] Tucker said that he scooped the raccoon up with his",https://transcripts.cnn.com/show/ctmo/date/2026-07-17/segment/01,other_context
partner_media,CNN,2026-07-17,CNN.com - Transcripts,"CNN.com - Transcripts Transcript Providers Return to Transcripts main page The Situation Room Economic Impact of World Cup?; U.S. Targets Iranian Bridges; Trump's Teleprompter Operator Involved in Insider Trading?; Lettuce Served at Taco Bell Tied to Regional Parasitic Outbreak. Aired 10:30a- 11a ET Aired July 17, 2026 - 10:30 ET THIS IS A RUSH TRANSCRIPT. THIS COPY MAY NOT BE IN ITS FINAL FORM AND MAY BE UPDATED. JACQUELINE HOWARD, CNN HEALTH REPORTER: But what the CDC has recently identified i",https://transcripts.cnn.com/show/sitroom/date/2026-07-17/segment/02,scandal_integrity
partner_media,CNN,2026-07-18,CNN.com - Transcripts,"CNN.com - Transcripts Transcript Providers Return to Transcripts main page CNN This Morning Iran targets Military Bases As U.S. Launches Wave Of Strikes; Trump Threatens Canada With Tariffs Over Wildfire Smoke; Forecast Improving For Areas Hit Hard By Heavy Rain, Floods In Texas; U.S. Forest Service Employees Are Freed After 15-Hour Hostage Ordeal; White House Teleprompter Operator Placed On Leave Amid Prediction Market Insider Trading Investigation; Trump Tests China Relations With Election Med",https://transcripts.cnn.com/show/ctmo/date/2026-07-18/segment/01,scandal_integrity
independent_media,The Guardian,2026-02-12,,,https://www.theguardian.com/us-news/2026/feb/12/kalshi-and-polymarket-prohibit-affiliates-from-spreading-election-misinformation,no_captured_text
independent_media,The Guardian,2026-05-19,,,https://www.theguardian.com/us-news/2026/may/19/justices-lift-rulings-barring-prediction-market-startup-kalshi-from-offering-sports-betting,no_captured_text
independent_media,The Guardian,2026-06-21,,,https://www.theguardian.com/us-news/2026/jun/21/prediction-markets-surge-us-public-health-advocates-gambling,no_captured_text
independent_media,The Guardian,2026-07-16,,,https://www.theguardian.com/us-news/2026/jul/16/white-house-teleprompter-operator-put-on-leave-alleged-bets-trump-speeches,no_captured_text
independent_media,The Guardian,2026-07-16,,,https://www.theguardian.com/us-news/2026/jul/16/fda-jazz-pharmaceuticals-drug-trial-results-kalshi-polymarket,no_captured_text
independent_media,Axios,2026-03-17,,,https://www.axios.com/2026/03/17/kalshi-polymarket-sports-betting,no_captured_text
independent_media,Axios,2026-07-16,,,https://www.axios.com/2026/07/16/teleprompter-trump-kalshi-prediction-market-bets,no_captured_text
independent_media,Axios,2026-04-10,,,https://www.axios.com/local/phoenix/2026/04/10/arizona-cannot-regulate-operator-kalshi,no_captured_text
independent_media,Business Insider,2026-06-01,,,https://www.businessinsider.com/kalshi-near-billion-dollar-valuation-fundraising-round-report-2026-6,no_captured_text
independent_media,Business Insider,2026-07-16,,,https://www.businessinsider.com/trump-teleprompter-operator-investigation-kalshi-bets-speeches-2026-7,no_captured_text
independent_media,Business Insider,2026-07-17,,,https://www.businessinsider.com/flight-cancellation-betting-sparks-consumer-protection-concerns-2026-7,no_captured_text
independent_media,Investopedia,2026-07-17,Philip Morris Stock Tumbles as Sales Miss Estimates,Philip Morris Stock Tumbles as Sales Miss Estimates Skip to content Investopedia Trade Search Please fill out this field. Log In My Account Log Out Newsletters Search Please fill out this field. News News Markets Companies Earnings CD Rates Mortgage Rates Economy Government Crypto Live Markets News Personal Finance View All Investing Investing Stocks Cryptocurrency Bonds ETFs Options and Derivatives Commodities Trading Automated Investing Brokers Fundamental Analysis View All Simulator Simulator,https://www.investopedia.com/polymarket-ties-with-x-could-make-it-a-more-trusted-betting-source-11776697,scandal_integrity
independent_media,Investopedia,2026-06-24,,,https://www.investopedia.com/pro-trump-prediction-markets-kalshi-and-polymarket-trump-ceasefire-comments-11762459,no_captured_text
independent_media,Investopedia,2026-06-20,,,https://www.investopedia.com/bettors-believe-u-s-will-retaliate-to-iranian-missile-attacks-by-the-weekend-11758428,no_captured_text
independent_media,Forbes Advisor,2026-07-01,,,https://www.forbes.com/advisor/investing/prediction-markets/,no_captured_text
independent_media,Forbes Business Council,2026-05-05,The Rise Of Prediction Markets In The USA,The Rise Of Prediction Markets In The USA Sign Up For Newsletters Games Share a News Tip Featured Featured Breaking News White House Watch Daily Cover Stories 2026 Best Brands For Value 2026 Forbes World's Most Influential CMOs List The AI Risks CEOs Didn’t Budget For | Paid Program The Resilient Enterprise: How A Strategic Insurance Partner Helps Large Firms Navigate Evolving Threats | Paid Program Making It Their Way: Six TikTok Creators On Finding A High-Quality Content Strategy That Pays Off,https://www.forbes.com/councils/forbesbusinesscouncil/2026/05/05/the-rise-of-prediction-markets-in-the-usa/,other_context
independent_media,Forbes,2026-04-15,Prediction Markets Are Scaling Faster Than The Law,Prediction Markets Are Scaling Faster Than The Law Sign Up For Newsletters Games Share a News Tip Featured Featured Breaking News White House Watch Daily Cover Stories 2026 Best Brands For Value 2026 Forbes World's Most Influential CMOs List The AI Risks CEOs Didn’t Budget For | Paid Program The Resilient Enterprise: How A Strategic Insurance Partner Helps Large Firms Navigate Evolving Threats | Paid Program Making It Their Way: Six TikTok Creators On Finding A High-Quality Content Strategy That,https://www.forbes.com/sites/ajdhaliwal/2026/04/15/prediction-markets-are-scaling-faster-than-the-law/,growth_legitimacy
independent_media,Forbes,2026-06-01,Kalshi’s CEO Wants To Turn Every Question Into A Market,Kalshi’s CEO Wants To Turn Every Question Into A Market Sign Up For Newsletters Games Share a News Tip Featured Featured Breaking News White House Watch Daily Cover Stories 2026 Best Brands For Value 2026 Forbes World's Most Influential CMOs List The AI Risks CEOs Didn’t Budget For | Paid Program The Resilient Enterprise: How A Strategic Insurance Partner Helps Large Firms Navigate Evolving Threats | Paid Program Making It Their Way: Six TikTok Creators On Finding A High-Quality Content Strategy,https://www.forbes.com/sites/digital-assets/2026/06/01/kalshis-ceo-wants-to-turn-every-question-into-a-market/,growth_legitimacy
independent_media,Forbes,2026-04-27,Prediction Market’s First Insider Trading Case,Prediction Market’s First Insider Trading Case Sign Up For Newsletters Games Share a News Tip Featured Featured Breaking News White House Watch Daily Cover Stories 2026 Best Brands For Value 2026 Forbes World's Most Influential CMOs List The AI Risks CEOs Didn’t Budget For | Paid Program The Resilient Enterprise: How A Strategic Insurance Partner Helps Large Firms Navigate Evolving Threats | Paid Program Making It Their Way: Six TikTok Creators On Finding A High-Quality Content Strategy That Pay,https://www.forbes.com/sites/walterpavlo/2026/04/27/prediction-markets-first-insider-trading-case/,scandal_integrity
independent_media,The Washington Post,2026-06-23,,,https://www.washingtonpost.com/politics/2026/06/23/why-prediction-markets-election-picks-are-useful-even-when-they-seem-wrong/,no_captured_text
independent_media,The Washington Post,2026-06-28,,,https://www.washingtonpost.com/opinions/2026/06/28/qa-with-kalshis-tarek-mansour-prediction-market-prophet//,no_captured_text
independent_media,Associated Press,2026-02-17,"Trump administration backs Kalshi, Polymarket as states move to ban prediction markets","Trump administration backs Kalshi, Polymarket as states move to ban prediction markets | AP News Menu World SECTIONS Iran war Russia-Ukraine war Español China Asia Pacific Latin America Europe Africa TOP STORIES US military carries out strikes on Iran as both sides threaten civilian infrastructure Iran's demands over the Strait of Hormuz would set a dangerous precedent, Rubio warns Asian leaders What to know about Iran's Pickaxe Mountain, home to an underground nuclear site threatened by Trump N",https://apnews.com/article/cf1fa23f126a77400a363ba920afcfbf,regulatory_jurisdiction
independent_media,Associated Press,2026-04-09,"Prediction markets, filled with 24/7 bets, are regulated differently than traditional gambling","Polymarket flagged a classified-info trade as the Maduro raid bet led to a $400,000 win | AP News Menu World SECTIONS Iran war Russia-Ukraine war Español China Asia Pacific Latin America Europe Africa TOP STORIES US military carries out strikes on Iran as both sides threaten civilian infrastructure Iran's demands over the Strait of Hormuz would set a dangerous precedent, Rubio warns Asian leaders What to know about Iran's Pickaxe Mountain, home to an underground nuclear site threatened by Trump ",https://apnews.com/article/823b748b446f2fccbbe760b6e60fbab3,scandal_integrity
