source_type,source_name,published_at,page_title,excerpt,url,frame_tag
regulatory_critical,Senate Commerce Committee,2026-04-30,"Commerce Committee Announces Upcoming Hearing on Sports Betting - U.S. Senate Committee on Commerce, Science, & Transportation","Commerce Committee Announces Upcoming Hearing on Sports Betting - U.S. Senate Committee on Commerce, Science, & Transportation Skip to content Home About The Chairman The Ranking Member Committee Members Subcommittees History Rules Contact FAQs Whistleblower Newsroom Republican News Democratic News Press Contacts Hearings Hearings Markups Legislation Nominations About The Chairman The Ranking Member Committee Members Subcommittees History Rules Contact FAQs Whistleblower Newsroom Republican News",https://www.commerce.senate.gov/press/rep/release/commerce-committee-announces-upcoming-hearing-on-sports-betting/,regulatory_jurisdiction
regulatory_critical,CFTC,2026-07-14,CFTC Stays KalshiEX Rule Change and Exercises Emergency Authority to Order Fulfillment of Pending Trades | CFTC,CFTC Stays KalshiEX Rule Change and Exercises Emergency Authority to Order Fulfillment of Pending Trades | CFTC /PressRoom/PressReleases/9267-26 Skip to main content Transparency Contact Us Search Search Main navigation About the CFTC The Commission Chairman & Commissioners CFTC Organization Advisory Committees Innovation at the CFTC Agriculture at the CFTC Budget & Performance Privacy at the CFTC Careers Industry Oversight Industry Filings Trading Organizations Clearing Organizations Data Repos,https://www.cftc.gov/PressRoom/PressReleases/9267-26,regulatory_jurisdiction
regulatory_critical,CFTC,2026-06-12,CFTC Sues New Mexico as the State Becomes the Latest Attempting to Infringe on Federal Jurisdiction | CFTC,CFTC Sues New Mexico as the State Becomes the Latest Attempting to Infringe on Federal Jurisdiction | CFTC /PressRoom/PressReleases/9251-26 Skip to main content Transparency Contact Us Search Search Main navigation About the CFTC The Commission Chairman & Commissioners CFTC Organization Advisory Committees Innovation at the CFTC Agriculture at the CFTC Budget & Performance Privacy at the CFTC Careers Industry Oversight Industry Filings Trading Organizations Clearing Organizations Data Repositori,https://www.cftc.gov/PressRoom/PressReleases/9251-26,regulatory_jurisdiction
regulatory_critical,CFTC,2026-05-29,"CFTC Approves BTCPERP Contract Submitted by KalshiEX, LLC | CFTC","CFTC Approves BTCPERP Contract Submitted by KalshiEX, LLC | CFTC /PressRoom/PressReleases/9240-26 Skip to main content Transparency Contact Us Search Search Main navigation About the CFTC The Commission Chairman & Commissioners CFTC Organization Advisory Committees Innovation at the CFTC Agriculture at the CFTC Budget & Performance Privacy at the CFTC Careers Industry Oversight Industry Filings Trading Organizations Clearing Organizations Data Repositories Intermediaries Market Surveillance Cont",https://www.cftc.gov/PressRoom/PressReleases/9240-26,regulatory_jurisdiction
regulatory_critical,CFTC,2026-04-28,CFTC Sues Wisconsin to Reaffirm its Exclusive Jurisdiction Over Prediction Markets | CFTC,CFTC Sues Wisconsin to Reaffirm its Exclusive Jurisdiction Over Prediction Markets | CFTC /PressRoom/PressReleases/9220-26 Skip to main content Transparency Contact Us Search Search Main navigation About the CFTC The Commission Chairman & Commissioners CFTC Organization Advisory Committees Innovation at the CFTC Agriculture at the CFTC Budget & Performance Privacy at the CFTC Careers Industry Oversight Industry Filings Trading Organizations Clearing Organizations Data Repositories Intermediaries,https://www.cftc.gov/PressRoom/PressReleases/9220-26,regulatory_jurisdiction
regulatory_critical,CFTC,2026-02-12,CFTC Announces Innovation Advisory Committee Members | CFTC,CFTC Announces Innovation Advisory Committee Members | CFTC /PressRoom/PressReleases/9182-26 Skip to main content Transparency Contact Us Search Search Main navigation About the CFTC The Commission Chairman & Commissioners CFTC Organization Advisory Committees Innovation at the CFTC Agriculture at the CFTC Budget & Performance Privacy at the CFTC Careers Industry Oversight Industry Filings Trading Organizations Clearing Organizations Data Repositories Intermediaries Market Surveillance Contracts,https://www.cftc.gov/PressRoom/PressReleases/9182-26,regulatory_jurisdiction
regulatory_critical,CFTC,2025-12-10,Acting Chairman Pham Announces CEO Innovation Council Participants | CFTC,Acting Chairman Pham Announces CEO Innovation Council Participants | CFTC /PressRoom/PressReleases/9150-25 Skip to main content Transparency Contact Us Search Search Main navigation About the CFTC The Commission Chairman & Commissioners CFTC Organization Advisory Committees Innovation at the CFTC Agriculture at the CFTC Budget & Performance Privacy at the CFTC Careers Industry Oversight Industry Filings Trading Organizations Clearing Organizations Data Repositories Intermediaries Market Surveill,https://www.cftc.gov/PressRoom/PressReleases/9150-25,regulatory_jurisdiction
regulatory_critical,Senator Elizabeth Warren,2026-03-30,"Warren, 40+ Lawmakers Push Regulators to Address Illegal Insider Trading in Prediction Markets","Warren, 40+ Lawmakers Push Regulators to Address Illegal Insider Trading in Prediction Markets Skip to content Home About About Elizabeth Voting Record Legislation Committee Assignments News Press Releases In The News Op-eds Social Media Services Help with a Federal Agency Education Housing Immigration, Citizenship & Visas Medicare Military Assistance Passports Social Security Taxes & IRS Veterans Affairs Office of Personnel Management Other Labor Flag Requests Tour Requests Tour Request Form In",https://www.warren.senate.gov/newsroom/press-releases/warren-40-lawmakers-push-regulators-to-address-illegal-insider-trading-in-prediction-markets,scandal_integrity
regulatory_critical,Senator Elizabeth Warren,2026-02-17,Warren Statement on Trump’s CFTC Preempting State Regulation on Prediction Markets,"Warren Statement on Trump’s CFTC Preempting State Regulation on Prediction Markets Skip to content Home About About Elizabeth Voting Record Legislation Committee Assignments News Press Releases In The News Op-eds Social Media Services Help with a Federal Agency Education Housing Immigration, Citizenship & Visas Medicare Military Assistance Passports Social Security Taxes & IRS Veterans Affairs Office of Personnel Management Other Labor Flag Requests Tour Requests Tour Request Form Internships Sp",https://www.warren.senate.gov/news/press-releases/warren-statement-on-trumps-cftc-preempting-state-regulation-on-prediction-markets/,regulatory_jurisdiction
regulatory_critical,Senator Elizabeth Warren,2026-04-30,"At Hearing, Warren Questions Hegseth on Insider Trading During Iran War As He Ducks Responsibility","At Hearing, Warren Questions Hegseth on Insider Trading During Iran War As He Ducks Responsibility Skip to content Home About About Elizabeth Voting Record Legislation Committee Assignments News Press Releases In The News Op-eds Social Media Services Help with a Federal Agency Education Housing Immigration, Citizenship & Visas Medicare Military Assistance Passports Social Security Taxes & IRS Veterans Affairs Office of Personnel Management Other Labor Flag Requests Tour Requests Tour Request For",https://www.warren.senate.gov/newsroom/press-releases/at-hearing-warren-questions-hegseth-on-insider-trading-during-iran-war-as-he-ducks-responsibility/,scandal_integrity
regulatory_critical,CFTC,2026-05-19,CFTC Sues Minnesota to Block State Law | CFTC,CFTC Sues Minnesota to Block State Law | CFTC /PressRoom/PressReleases/9233-26 Skip to main content Transparency Contact Us Search Search Main navigation About the CFTC The Commission Chairman & Commissioners CFTC Organization Advisory Committees Innovation at the CFTC Agriculture at the CFTC Budget & Performance Privacy at the CFTC Careers Industry Oversight Industry Filings Trading Organizations Clearing Organizations Data Repositories Intermediaries Market Surveillance Contracts & Products Ru,https://www.cftc.gov/PressRoom/PressReleases/9233-26,regulatory_jurisdiction
