pair_id,article_id,market_id,article_url,article_title,context_excerpt,evidence_text,quoted_price,quoted_price_unit,source_notes,publication_time,source_type,platform,topic,match_status,snapshot_status,double_code,coder_id,market_probability_present,probability_as_public_opinion,representativeness_caveat,market_quality_caveat,certainty_language,democratic_language,horse_race_frame,overreach_severity,notes,quality_evidence_class,price_at_publication,trade_count_window,volume_window,spread_at_publication,quality_missing
0f9469781755a724,kalshi_archive_018,KXNEXTTEAMNBA-26LJAM,https://news.kalshi.com/p/lebron-james-next-team-odds-miami-heat-surge,LeBron James next team odds: Miami's odds skyrocket as decision looms,"LeBron James next team odds: Miami's odds skyrocket as decision looms Sign Up Search News Sports 2026 Midterm Hub Markets Features Interviews Announcements Learn KPOW Authors Home Posts LeBron James next team odds: Miami's odds skyrocket as decision looms LeBron James next team odds: Miami's odds skyrocket as decision looms Traders now give the Heat a 53% chance to land James, with the Cavaliers' odds falling to 24%. By Kalshi News Jul 18, 2026 LeBron James is still without a team, but Kalshi tr",next-team market,85,%,Discovered from Kalshi News archive page 2,2026-07-18T21:35:18.907Z,platform_owned,kalshi,,exact_identifier,historical_price_matched,0,,1,0,0,1,1,0,1,1,AI ai_coder_a heuristic annotation.,historical_price_matched,0.8500,,,,1
814586f4d40c71ee,kalshi_archive_036,KXA100WS-26JUL17,https://news.kalshi.com/p/compute-forward-curves,Compute forward curves — Kalshi,"Kalshi Announces Compute Forward Curves Sign Up Search News Sports 2026 Midterm Hub Markets Features Interviews Announcements Learn KPOW Authors Home Posts Kalshi Announces Compute Forward Curves, Becoming the Exchange for the AI Economy Kalshi Announces Compute Forward Curves, Becoming the Exchange for the AI Economy Forward curves for Nvidia B200, H200 and A100 chips — a product built entirely from Kalshi’s own trading activity — will help buyers and sellers of compute lock in prices and offlo",A100,,,Discovered from Kalshi News archive page 4,2026-07-14T15:00:00.000Z,platform_owned,kalshi,,exact_identifier,unavailable,0,,0,0,0,0,0,0,0,0,AI ai_coder_a heuristic annotation.,unavailable,,,,,1
830c4d1c71bbadd9,kalshi_archive_021,KXRT-DUNE,https://news.kalshi.com/p/the-odyssey-oscars-odds,"The Odyssey, the Oscars, and the odds","The Odyssey, the Oscars, and the odds Sign Up Search News Sports 2026 Midterm Hub Markets Features Interviews Announcements Learn KPOW Authors Home Posts The Odyssey, the Oscars, and the odds The Odyssey, the Oscars, and the odds From a near-perfect Rotten Tomatoes score to Best Picture frontrunner status, many Kalshi traders are all in on The Odyssey. By Jack Kuveke Jul 17, 2026 If you're anything like me, every year in July or August you get nostalgic for going to the movies when you were a ki",the Dune,,,Discovered from Kalshi News archive page 3,2026-07-17T20:33:38.123Z,platform_owned,kalshi,,exact_identifier,unavailable,0,,1,1,0,1,0,0,1,2,AI ai_coder_a heuristic annotation.,unavailable,,,,,1
96b7a77a91993341,kalshi_archive_017,KXMENWORLDCUP-26,https://news.kalshi.com/p/world-cup-final-halftime-show-odds-who-will-perform-what-songs,World Cup Final halftime show odds: Who will perform and what songs will they play?,"World Cup Final halftime show odds: Who will perform and what songs will they play? Sign Up Search News Sports 2026 Midterm Hub Markets Features Interviews Announcements Learn KPOW Authors Home Posts World Cup Final halftime show odds: Who will perform and what songs will they play? World Cup Final halftime show odds: Who will perform and what songs will they play? The World Cup Final’s 30-minute halftime show will feature Justin Bieber, Madonna, Shakira, and BTS. By Danny Gallagher Jul 19, 2026",World Cup final,,,Discovered from Kalshi News archive page 2,2026-07-19T01:30:41.164Z,platform_owned,kalshi,,exact_identifier,unavailable,0,,1,0,0,0,0,0,1,2,AI ai_coder_a heuristic annotation.,unavailable,,,,,1
ce2587645723e34c,kalshi_archive_009,KXBALLONDOR-26,https://news.kalshi.com/p/ballon-dor-odds-2026-harry-kane-yamal-rodri,Kalshi's Ballon d'Or odds favor Harry Kane over Spain's World Cup stars,"Kalshi's Ballon d'Or odds favor Harry Kane over Spain's World Cup stars Sign Up Search News Sports 2026 Midterm Hub Markets Features Interviews Announcements Learn KPOW Authors Home Posts Kalshi's Ballon d'Or odds favor Kane over Spain's World Cup stars Kalshi's Ballon d'Or odds favor Kane over Spain's World Cup stars Traders price Kane's chances at 43%, with Yamal and Rodri close behind. By Danny Gallagher Jul 21, 2026 England fell short of a World Cup title, but Kalshi traders still view Harry",this year's Ballon d'Or,,,Discovered from Kalshi News archive page 1,2026-07-21T14:42:08.732Z,platform_owned,kalshi,,exact_identifier,unavailable,0,,1,1,0,1,0,0,1,2,AI ai_coder_a heuristic annotation.,unavailable,,,,,1
596e549420f43d6b,kalshi_archive_041,KXSCRSENS-26,https://news.kalshi.com/p/the-week-ahead-primaries-power-vacuums-and-kalshi-pro,"The week ahead: Primaries, power vacuums, and Kalshi Pro","The week ahead: Primaries, power vacuums, and Kalshi Pro Sign Up Search News Sports 2026 Midterm Hub Markets Features Interviews Announcements Learn KPOW Authors Home Posts The week ahead: Primaries, power vacuums, and Kalshi Pro The week ahead: Primaries, power vacuums, and Kalshi Pro From Maine's midterm meltdown to South Carolina's senate scramble, here are the markets that matter for the week of July 13. By Jack Kuveke Jul 13, 2026 Good morning traders, Sadly, on Saturday, longtime Senator L",Kalshi’s markets,,,Discovered from Kalshi News archive page 5,2026-07-13T19:27:43.417Z,platform_owned,kalshi,,exact_identifier,unavailable,0,,0,0,0,0,0,0,0,0,AI ai_coder_a heuristic annotation.,unavailable,,,,,1
d142bead90ced999,kalshi_archive_012,KXBIGBROTHER-26DEC31,https://news.kalshi.com/p/the-week-ahead-big-business-and-big-brother,"Big Brother, Zyn & company KPI odds this week","Big Brother, Zyn & company KPI odds this week Sign Up Search News Sports 2026 Midterm Hub Markets Features Interviews Announcements Learn KPOW Authors Home Posts The week ahead: Big business and Big Brother The week ahead: Big business and Big Brother From KPIs to the KPOW index, here are the markets that matter for the week of July 20. By Jack Kuveke Jul 20, 2026 Image credit: CBS | Kalshi is not affiliated with Big Brother. Good afternoon, traders. I hope that your weekend was enjoyable and re",evicted houseguests votes to crown the winner,,,Discovered from Kalshi News archive page 2,2026-07-20T20:31:10.149Z,platform_owned,kalshi,,exact_identifier,unavailable,0,,1,0,0,0,0,0,1,2,AI ai_coder_a heuristic annotation.,unavailable,,,,,1
a42b166e61ca97d0,kalshi_archive_013,KXMENWORLDCUP-26,https://news.kalshi.com/p/spain-vs-argentina-world-cup-final-odds-predictions,Spain vs. Argentina World Cup Final odds: can Messi's men repeat the 2022 magic?,"Spain vs. Argentina World Cup Final odds: can Messi's men repeat the 2022 magic? Sign Up Search News Sports 2026 Midterm Hub Markets Features Interviews Announcements Learn KPOW Authors Home Posts Spain vs. Argentina World Cup Final odds: can Messi's men repeat the 2022 magic? Spain vs. Argentina World Cup Final odds: can Messi's men repeat the 2022 magic? Traders price Spain as clear favorites, but Argentina keeps finding ways to win. By Kalshi News Jul 19, 2026 The 2026 FIFA World Cup is final",58%,58,%,Discovered from Kalshi News archive page 2,2026-07-19T17:13:21.307Z,platform_owned,kalshi,,exact_identifier,historical_price_matched,0,,1,0,0,1,1,0,1,1,AI ai_coder_a heuristic annotation.,historical_price_matched,0.5800,,,,1
4e21b2c513a2cce1,kalshi_archive_013,KXWCMOV-26JUL19ESPARG,https://news.kalshi.com/p/spain-vs-argentina-world-cup-final-odds-predictions,Spain vs. Argentina World Cup Final odds: can Messi's men repeat the 2022 magic?,"Spain vs. Argentina World Cup Final odds: can Messi's men repeat the 2022 magic? Sign Up Search News Sports 2026 Midterm Hub Markets Features Interviews Announcements Learn KPOW Authors Home Posts Spain vs. Argentina World Cup Final odds: can Messi's men repeat the 2022 magic? Spain vs. Argentina World Cup Final odds: can Messi's men repeat the 2022 magic? Traders price Spain as clear favorites, but Argentina keeps finding ways to win. By Kalshi News Jul 19, 2026 The 2026 FIFA World Cup is final",20%,58,%,Discovered from Kalshi News archive page 2,2026-07-19T17:13:21.307Z,platform_owned,kalshi,,exact_identifier,historical_price_matched,0,,1,0,0,1,1,0,1,1,AI ai_coder_a heuristic annotation.,historical_price_matched,0.5800,,,,1
828a5b3f7552ed57,kalshi_archive_036,KXH200WS-26JUL17,https://news.kalshi.com/p/compute-forward-curves,Compute forward curves — Kalshi,"Kalshi Announces Compute Forward Curves Sign Up Search News Sports 2026 Midterm Hub Markets Features Interviews Announcements Learn KPOW Authors Home Posts Kalshi Announces Compute Forward Curves, Becoming the Exchange for the AI Economy Kalshi Announces Compute Forward Curves, Becoming the Exchange for the AI Economy Forward curves for Nvidia B200, H200 and A100 chips — a product built entirely from Kalshi’s own trading activity — will help buyers and sellers of compute lock in prices and offlo",H200,,,Discovered from Kalshi News archive page 4,2026-07-14T15:00:00.000Z,platform_owned,kalshi,,exact_identifier,unavailable,0,,0,0,0,0,0,0,0,0,AI ai_coder_a heuristic annotation.,unavailable,,,,,1
b9318e13e9a6f301,kalshi_archive_024,KXBIGBROTHER-26DEC31,https://news.kalshi.com/p/big-brother-odds-predictions-week-1-eviction-season-28,Big Brother odds: Who will be the first evictee of Season 28?,"Big Brother odds: Who will be the first evictee of Season 28? Sign Up Search News Sports 2026 Midterm Hub Markets Features Interviews Announcements Learn KPOW Authors Home Posts Big Brother odds: Who will be the first evictee of Season 28? Big Brother odds: Who will be the first evictee of Season 28? Traders are pricing a 73% chance Ashley Trail is the first houseguest to be eliminated. By Danny Gallagher Jul 16, 2026 As the first week of Big Brother Season 28 winds down, Kalshi traders are weig",the eventual winner,,,Discovered from Kalshi News archive page 3,2026-07-16T22:07:42.890Z,platform_owned,kalshi,,exact_identifier,unavailable,0,,1,1,0,0,0,0,1,2,AI ai_coder_a heuristic annotation.,unavailable,,,,,1
19c28bce8df0c276,kalshi_archive_041,KXEARNINGSMENTIONNFLX-26JUL02,https://news.kalshi.com/p/the-week-ahead-primaries-power-vacuums-and-kalshi-pro,"The week ahead: Primaries, power vacuums, and Kalshi Pro","The week ahead: Primaries, power vacuums, and Kalshi Pro Sign Up Search News Sports 2026 Midterm Hub Markets Features Interviews Announcements Learn KPOW Authors Home Posts The week ahead: Primaries, power vacuums, and Kalshi Pro The week ahead: Primaries, power vacuums, and Kalshi Pro From Maine's midterm meltdown to South Carolina's senate scramble, here are the markets that matter for the week of July 13. By Jack Kuveke Jul 13, 2026 Good morning traders, Sadly, on Saturday, longtime Senator L",Netflix,,,Discovered from Kalshi News archive page 5,2026-07-13T19:27:43.417Z,platform_owned,kalshi,,exact_identifier,unavailable,0,,0,0,0,0,0,0,0,0,AI ai_coder_a heuristic annotation.,unavailable,,,,,1
3b6f0677c032e5b7,kalshi_archive_002,KXOSCARNOMBCASTING-27,https://news.kalshi.com/p/the-odyssey-oscar-odds-best-picture-director,"Oscar odds: The Odyssey leads Best Picture, Best Director, and more","Oscar odds: The Odyssey leads Best Picture, Best Director, and more Sign Up Search News Sports 2026 Midterm Hub Markets Features Interviews Announcements Learn KPOW Authors Home Posts Oscar odds: The Odyssey leads Best Picture, Best Director, and more Oscar odds: The Odyssey leads Best Picture, Best Director, and more Director Christopher Nolan's movie leads across multiple Oscar markets. By Danny Gallagher Jul 22, 2026 Christopher Nolan's The Odyssey isn't just winning over critics . The film a",Best Achievement in Casting,,,Discovered from Kalshi News archive page 1,2026-07-22T19:08:35.423Z,platform_owned,kalshi,,exact_identifier,unavailable,0,,1,0,0,0,1,0,1,2,AI ai_coder_a heuristic annotation.,unavailable,,,,,1
91ae6bb2c74402bb,kalshi_archive_039,KXRT-ODY,https://news.kalshi.com/p/the-odyssey-rotten-tomatoes-odds,The Odyssey Rotten Tomatoes odds soar,"The Odyssey's Rotten Tomatoes odds soar as review embargo comes to a close Sign Up Search News Sports 2026 Midterm Hub Markets Features Interviews Announcements Learn KPOW Authors Home Posts The Odyssey's Rotten Tomatoes odds soar as review embargo comes to a close The Odyssey's Rotten Tomatoes odds soar as review embargo comes to a close Traders are predicting a 92% rating for Christopher Nolan’s newest film. By Danny Gallagher Jul 13, 2026 Christopher Nolan's next film hasn't reached theaters ",a 92% score,92,%,Discovered from Kalshi News archive page 5,2026-07-13T21:51:42.613Z,platform_owned,kalshi,,exact_identifier,historical_price_matched,0,,1,0,0,1,0,0,1,1,AI ai_coder_a heuristic annotation.,historical_price_matched,0.9200,,,,1
acab6543a3c5b166,kalshi_archive_012,KXEARNINGSMENTIONAAL-26JUL23,https://news.kalshi.com/p/the-week-ahead-big-business-and-big-brother,"Big Brother, Zyn & company KPI odds this week","Big Brother, Zyn & company KPI odds this week Sign Up Search News Sports 2026 Midterm Hub Markets Features Interviews Announcements Learn KPOW Authors Home Posts The week ahead: Big business and Big Brother The week ahead: Big business and Big Brother From KPIs to the KPOW index, here are the markets that matter for the week of July 20. By Jack Kuveke Jul 20, 2026 Image credit: CBS | Kalshi is not affiliated with Big Brother. Good afternoon, traders. I hope that your weekend was enjoyable and re",What will American Airlines say during their next earnings call?,,,Discovered from Kalshi News archive page 2,2026-07-20T20:31:10.149Z,platform_owned,kalshi,,exact_identifier,unavailable,0,,1,0,0,0,0,0,1,2,AI ai_coder_a heuristic annotation.,unavailable,,,,,1
633cb765fc4d1693,kalshi_archive_021,KXRT-ODY,https://news.kalshi.com/p/the-odyssey-oscars-odds,"The Odyssey, the Oscars, and the odds","The Odyssey, the Oscars, and the odds Sign Up Search News Sports 2026 Midterm Hub Markets Features Interviews Announcements Learn KPOW Authors Home Posts The Odyssey, the Oscars, and the odds The Odyssey, the Oscars, and the odds From a near-perfect Rotten Tomatoes score to Best Picture frontrunner status, many Kalshi traders are all in on The Odyssey. By Jack Kuveke Jul 17, 2026 If you're anything like me, every year in July or August you get nostalgic for going to the movies when you were a ki",The Odyssey,,,Discovered from Kalshi News archive page 3,2026-07-17T20:33:38.123Z,platform_owned,kalshi,,exact_identifier,unavailable,0,,1,1,0,1,0,0,1,2,AI ai_coder_a heuristic annotation.,unavailable,,,,,1
900fdc71f3d9abd9,kalshi_archive_033,KXWCADVANCE-26JUL14FRAESP,https://news.kalshi.com/p/france-vs-spain-semifinal-odds-predictions-world-cup,France vs. Spain semifinal odds: Traders make Les Bleus the favorite at 58%,"France vs. Spain semifinal odds: Traders make Les Bleus the favorite at 58% Sign Up Search News Sports 2026 Midterm Hub Markets Features Interviews Announcements Learn KPOW Authors Home Posts France vs. Spain semifinal odds: Traders make Les Bleus the favorite at 58% France vs. Spain semifinal odds: Traders make Les Bleus the favorite at 58% Kalshi traders price France with a slight edge, but whoever wins likely becomes the World Cup favorite. By Kalshi News Jul 14, 2026 The 2026 World Cup semif",58%,58,%,Discovered from Kalshi News archive page 4,2026-07-14T18:12:50.621Z,platform_owned,kalshi,,exact_identifier,historical_price_matched,0,,1,1,0,1,1,0,1,2,AI ai_coder_a heuristic annotation.,historical_price_matched,0.5800,,,,1
5b6522b592c8bf86,kalshi_archive_041,KXEARNINGSMENTIONGS-26JUL14,https://news.kalshi.com/p/the-week-ahead-primaries-power-vacuums-and-kalshi-pro,"The week ahead: Primaries, power vacuums, and Kalshi Pro","The week ahead: Primaries, power vacuums, and Kalshi Pro Sign Up Search News Sports 2026 Midterm Hub Markets Features Interviews Announcements Learn KPOW Authors Home Posts The week ahead: Primaries, power vacuums, and Kalshi Pro The week ahead: Primaries, power vacuums, and Kalshi Pro From Maine's midterm meltdown to South Carolina's senate scramble, here are the markets that matter for the week of July 13. By Jack Kuveke Jul 13, 2026 Good morning traders, Sadly, on Saturday, longtime Senator L",Goldman Sachs,,,Discovered from Kalshi News archive page 5,2026-07-13T19:27:43.417Z,platform_owned,kalshi,,exact_identifier,unavailable,0,,0,0,0,0,0,0,0,0,AI ai_coder_a heuristic annotation.,unavailable,,,,,1
06d00fabb263d262,kalshi_archive_017,KXWORLDCUPHALFTIME-26-POS,https://news.kalshi.com/p/world-cup-final-halftime-show-odds-who-will-perform-what-songs,World Cup Final halftime show odds: Who will perform and what songs will they play?,"World Cup Final halftime show odds: Who will perform and what songs will they play? Sign Up Search News Sports 2026 Midterm Hub Markets Features Interviews Announcements Learn KPOW Authors Home Posts World Cup Final halftime show odds: Who will perform and what songs will they play? World Cup Final halftime show odds: Who will perform and what songs will they play? The World Cup Final’s 30-minute halftime show will feature Justin Bieber, Madonna, Shakira, and BTS. By Danny Gallagher Jul 19, 2026",30%,30,%,Discovered from Kalshi News archive page 2,2026-07-19T01:30:41.164Z,platform_owned,kalshi,,exact_identifier,historical_price_matched,0,,1,0,0,0,0,0,1,2,AI ai_coder_a heuristic annotation.,historical_trade_matched,0.2700,8680,513510.33,,0
b270a94f5c46cc6c,kalshi_archive_040,KXWCADVANCE-26JUL14FRAESP,https://news.kalshi.com/p/france-vs-spain-world-cup-semifinal-odds,France vs. Spain World Cup semifinal odds,"France vs. Spain World Cup semifinal odds Sign Up Search News Sports 2026 Midterm Hub Markets Features Interviews Announcements Learn KPOW Authors Home Posts France vs. Spain World Cup semifinal predictions: can Spain spoil Les Bleus' run to the final? France vs. Spain World Cup semifinal predictions: can Spain spoil Les Bleus' run to the final? Kalshi traders price Mbappé's side at 59% to reach the final, but Rodri and Spain's midfield have other ideas. By Kalshi News Jul 13, 2026 The 2026 FIF",59% chance,59,%,Discovered from Kalshi News archive page 5,2026-07-13T21:03:02.758Z,platform_owned,kalshi,,exact_identifier,historical_price_matched,0,,1,1,0,1,0,0,1,2,AI ai_coder_a heuristic annotation.,historical_price_matched,0.5900,,,,1
98f34ec4d3bb3497,kalshi_archive_001,KXNEXTTEAMNBA-26LJAM,https://news.kalshi.com/p/miami-lebron-james-next-team-odds,Odds swing toward Miami in LeBron James 'next team' market,"Odds swing toward Miami in LeBron James 'next team' market Sign Up Search News Sports 2026 Midterm Hub Markets Features Interviews Announcements Learn KPOW Authors Home Posts Odds swing toward Miami in LeBron James 'next team' market Odds swing toward Miami in LeBron James 'next team' market Kalshi traders now price the chances of King James joining the Heat at 49%. By Danny Gallagher Jul 22, 2026 The Miami Heat have reclaimed the lead in Kalshi's market for LeBron James' next team after the clu",James' next team,49,%,Discovered from Kalshi News archive page 1,2026-07-22T22:13:49.746Z,platform_owned,kalshi,,exact_identifier,historical_price_matched,1,,1,1,0,0,1,0,1,2,AI adjudication based on rubric heuristics.,historical_price_matched,0.4900,,,,1
b6e15ff0bd1e43e5,kalshi_archive_002,KXOSCARNOMSCORE-27,https://news.kalshi.com/p/the-odyssey-oscar-odds-best-picture-director,"Oscar odds: The Odyssey leads Best Picture, Best Director, and more","Oscar odds: The Odyssey leads Best Picture, Best Director, and more Sign Up Search News Sports 2026 Midterm Hub Markets Features Interviews Announcements Learn KPOW Authors Home Posts Oscar odds: The Odyssey leads Best Picture, Best Director, and more Oscar odds: The Odyssey leads Best Picture, Best Director, and more Director Christopher Nolan's movie leads across multiple Oscar markets. By Danny Gallagher Jul 22, 2026 Christopher Nolan's The Odyssey isn't just winning over critics . The film a",the Best Original Score nomination,,,Discovered from Kalshi News archive page 1,2026-07-22T19:08:35.423Z,platform_owned,kalshi,,exact_identifier,unavailable,1,,1,0,0,0,1,0,1,2,AI ai_coder_a heuristic annotation.,unavailable,,,,,1
744bb29c0ab5922a,kalshi_archive_004,KXMLBNLCENT-26,https://news.kalshi.com/p/reds-vs-mariners-odds-predictions-game-2-july-21,Reds vs. Mariners predictions: Chase Burns looks to flip the series in Seattle,"Reds vs. Mariners predictions: Chase Burns looks to flip the series in Seattle Sign Up Search News Sports 2026 Midterm Hub Markets Features Interviews Announcements Learn KPOW Authors Home Posts Reds vs. Mariners predictions: Chase Burns looks to flip the series in Seattle Reds vs. Mariners predictions: Chase Burns looks to flip the series in Seattle Burns is 11-1 with a 2.54 ERA, but Kalshi traders still give Seattle the 53% edge at home. By Kalshi News Jul 21, 2026 Chase Burns takes the mound ",88%,61,%,Discovered from Kalshi News archive page 1,2026-07-21T23:41:00.608Z,platform_owned,kalshi,,exact_identifier,historical_price_matched,1,,1,1,0,1,1,0,1,2,AI ai_coder_a heuristic annotation.,historical_price_matched,0.6100,,,,1
2a4e3b7749dfaf6d,kalshi_archive_005,KXMLB-26,https://news.kalshi.com/p/dodgers-vs-phillies-odds-predictions-game-2-july-21,Dodgers vs. Phillies odds: Philadelphia opens as slight favorite in Game 2 showdown,"Dodgers vs. Phillies odds: Philadelphia opens as slight favorite in Game 2 showdown Sign Up Search News Sports 2026 Midterm Hub Markets Features Interviews Announcements Learn KPOW Authors Home Posts Dodgers vs. Phillies odds: Philadelphia opens as slight favorite in Game 2 showdown Dodgers vs. Phillies odds: Philadelphia opens as slight favorite in Game 2 showdown Traders give the Phillies a 53% chance to win tonight, while Los Angeles holds the NL's best shot at a World Series title at 33%. By",33%,53,%,Discovered from Kalshi News archive page 1,2026-07-21T22:35:10.154Z,platform_owned,kalshi,,exact_identifier,historical_price_matched,1,,1,1,0,1,1,0,1,2,AI ai_coder_a heuristic annotation.,historical_price_matched,0.5300,,,,1
b18bf828d9d4bcaf,kalshi_archive_005,KXMLBNL-26,https://news.kalshi.com/p/dodgers-vs-phillies-odds-predictions-game-2-july-21,Dodgers vs. Phillies odds: Philadelphia opens as slight favorite in Game 2 showdown,"Dodgers vs. Phillies odds: Philadelphia opens as slight favorite in Game 2 showdown Sign Up Search News Sports 2026 Midterm Hub Markets Features Interviews Announcements Learn KPOW Authors Home Posts Dodgers vs. Phillies odds: Philadelphia opens as slight favorite in Game 2 showdown Dodgers vs. Phillies odds: Philadelphia opens as slight favorite in Game 2 showdown Traders give the Phillies a 53% chance to win tonight, while Los Angeles holds the NL's best shot at a World Series title at 33%. By",44%,53,%,Discovered from Kalshi News archive page 1,2026-07-21T22:35:10.154Z,platform_owned,kalshi,,exact_identifier,historical_price_matched,1,,1,1,0,1,1,0,1,2,AI ai_coder_a heuristic annotation.,historical_price_matched,0.5300,,,,1
047748ba2fa31f65,kalshi_archive_012,KXEARNINGSMENTIONGEV-26JUL22,https://news.kalshi.com/p/the-week-ahead-big-business-and-big-brother,"Big Brother, Zyn & company KPI odds this week","Big Brother, Zyn & company KPI odds this week Sign Up Search News Sports 2026 Midterm Hub Markets Features Interviews Announcements Learn KPOW Authors Home Posts The week ahead: Big business and Big Brother The week ahead: Big business and Big Brother From KPIs to the KPOW index, here are the markets that matter for the week of July 20. By Jack Kuveke Jul 20, 2026 Image credit: CBS | Kalshi is not affiliated with Big Brother. Good afternoon, traders. I hope that your weekend was enjoyable and re",What will GE Vernova say during their next earnings call?,,,Discovered from Kalshi News archive page 2,2026-07-20T20:31:10.149Z,platform_owned,kalshi,,exact_identifier,unavailable,1,,1,0,0,0,0,0,1,2,AI ai_coder_a heuristic annotation.,unavailable,,,,,1
c200549a464e3b2d,kalshi_archive_012,KXSAMOMINF-26JUL22,https://news.kalshi.com/p/the-week-ahead-big-business-and-big-brother,"Big Brother, Zyn & company KPI odds this week","Big Brother, Zyn & company KPI odds this week Sign Up Search News Sports 2026 Midterm Hub Markets Features Interviews Announcements Learn KPOW Authors Home Posts The week ahead: Big business and Big Brother The week ahead: Big business and Big Brother From KPIs to the KPOW index, here are the markets that matter for the week of July 20. By Jack Kuveke Jul 20, 2026 Image credit: CBS | Kalshi is not affiliated with Big Brother. Good afternoon, traders. I hope that your weekend was enjoyable and re",South Africa inflation rate MoM?,,,Discovered from Kalshi News archive page 2,2026-07-20T20:31:10.149Z,platform_owned,kalshi,,exact_identifier,unavailable,1,,1,0,0,0,0,0,1,2,AI ai_coder_a heuristic annotation.,unavailable,,,,,1
